{
  "$schema": "http://json-schema.org/draft-07/schema#",
  "type": "object",
  "properties": {
    "id": {
      "type": "string"
    },
    "createTime": {
      "type": "string",
      "pattern": "^\\d{4}-\\d{2}-\\d{2}T\\d{2}:\\d{2}:\\d{2}$"
    },
    "updateTime": {
      "type": "string",
      "pattern": "^\\d{4}-\\d{2}-\\d{2}T\\d{2}:\\d{2}:\\d{2}$"
    },
    "name": {
      "type": "string"
    },
    "method": {
      "type": "string",
      "enum": [
        "POST",
        "GET",
        "PUT",
        "DELETE",
        "HEAD",
        "OPTIONS",
        "PATCH"
      ]
    },
    "url": {
      "type": "string"
    },
    "urlParam": {
      "type": "object",
      "properties": {
        "charset": {
          "type": "string"
        },
        "path": {
          "$ref": "#/definitions/keyValueItem"
        },
        "query": {
          "$ref": "#/definitions/contentTypeKeyValueItem"
        }
      },
      "required": [
        "charset",
        "path",
        "query"
      ]
    },
    "headers": {
      "$ref": "#/definitions/keyValueItem"
    },
    "cookies": {
      "$ref": "#/definitions/keyValueItem"
    },
    "body": {
      "oneOf": [
        {
          "type": "object",
          "properties": {
            "type": {
              "type": "string",
              "enum": [
                "NO_BODY"
              ]
            },
            "charset": {
              "type": "string"
            }
          },
          "required": [
            "type",
            "charset"
          ]
        },
        {
          "type": "object",
          "properties": {
            "type": {
              "type": "string",
              "enum": [
                "RAW"
              ]
            },
            "charset": {
              "type": "string"
            },
            "raw": {
              "type": "object",
              "properties": {
                "type": {
                  "type": "string",
                  "enum": [
                    "TEXT",
                    "JSON",
                    "XML",
                    "HTML"
                  ]
                },
                "raw": {
                  "type": "string"
                }
              },
              "required": [
                "type",
                "raw"
              ]
            }
          },
          "required": [
            "type",
            "charset",
            "raw"
          ]
        },
        {
          "type": "object",
          "properties": {
            "type": {
              "type": "string",
              "enum": [
                "BINARY"
              ]
            },
            "binary": {
              "type": "object",
              "properties": {
                "contentType": {
                  "type": "string"
                },
                "file": {
                  "type": "string"
                }
              },
              "required": [
                "contentType",
                "file"
              ]
            }
          },
          "required": [
            "type",
            "binary"
          ]
        },
        {
          "type": "object",
          "properties": {
            "type": {
              "type": "string",
              "enum": [
                "URL_ENCODED_FORM"
              ]
            },
            "charset": {
              "type": "string"
            },
            "urlEncodedForm": {
              "$ref": "#/definitions/contentTypeKeyValueItem"
            }
          },
          "required": [
            "type",
            "charset",
            "urlEncodedForm"
          ]
        },
        {
          "type": "object",
          "properties": {
            "type": {
              "type": "string",
              "enum": [
                "MULTIPART_FORM"
              ]
            },
            "charset": {
              "type": "string"
            },
            "multiPartForm": {
              "$ref": "#/definitions/fileKeyValueItem"
            }
          },
          "required": [
            "type",
            "charset",
            "multiPartForm"
          ]
        }
      ]
    }
  },
  "required": [
    "id",
    "createTime",
    "updateTime",
    "name",
    "method",
    "url",
    "body"
  ],
  "definitions": {
    "contentTypeKeyValueItem": {
      "$schema": "http://json-schema.org/draft-07/schema#",
      "type": "array",
      "items": {
        "type": "object",
        "properties": {
          "key": {
            "type": "string"
          },
          "value": {
            "type": "string"
          },
          "valueContentType": {
            "type": "string"
          },
          "selected": {
            "type": "boolean"
          }
        },
        "required": [
          "key",
          "value",
          "valueContentType",
          "selected"
        ]
      }
    },
    "fileKeyValueItem": {
      "$schema": "http://json-schema.org/draft-07/schema#",
      "type": "array",
      "items": {
        "type": "object",
        "properties": {
          "type": {
            "type": "string",
            "enum": [
              "TEXT",
              "FILE"
            ]
          },
          "key": {
            "type": "string"
          },
          "value": {
            "type": "string"
          },
          "valueContentType": {
            "type": "string"
          },
          "selected": {
            "type": "boolean"
          }
        },
        "required": [
          "type",
          "key",
          "value",
          "valueContentType",
          "selected"
        ]
      }
    },
    "keyValueItem": {
      "$schema": "http://json-schema.org/draft-07/schema#",
      "type": "array",
      "items": {
        "type": "object",
        "properties": {
          "key": {
            "type": "string"
          },
          "value": {
            "type": "string"
          },
          "selected": {
            "type": "boolean"
          }
        },
        "required": [
          "key",
          "value",
          "selected"
        ]
      }
    }
  }
}
