{
  "id" : "7M2S0Kxh",
  "createTime" : "2024-12-18T23:28:53",
  "updateTime" : "2025-03-08T00:24:39",
  "name" : "URL Encoded Form",
  "method" : "POST",
  "url" : "{{echoServer}}/echo.php",
  "urlParam" : {
    "charset" : "UTF-8",
    "path" : [ ],
    "query" : [ ]
  },
  "headers" : [ ],
  "cookies" : [ ],
  "body" : {
    "type" : "URL_ENCODED_FORM",
    "charset" : "UTF-8",
    "urlEncodedForm" : [ {
      "key" : "myparam1",
      "value" : "a",
      "selected" : true,
      "valueContentType" : "text/plain"
    }, {
      "key" : "myparam2",
      "value" : "b",
      "selected" : true,
      "valueContentType" : "text/plain"
    }, {
      "key" : "myparam3",
      "value" : "{{token}}",
      "selected" : true,
      "valueContentType" : "text/plain"
    }, {
      "key" : "disabledparam",
      "value" : "notSend!",
      "selected" : false,
      "valueContentType" : "text/plain"
    }, {
      "key" : "disabledparam2",
      "value" : "{{token}}",
      "selected" : false,
      "valueContentType" : "text/plain"
    } ]
  }
}