{
  "id" : "tmCsbrzA",
  "createTime" : "2024-12-18T23:26:19",
  "updateTime" : "2026-08-27T10:55:21",
  "name" : "Multipart Form",
  "method" : "POST",
  "url" : "{{echoServer}}/echo.php",
  "urlParam" : {
    "charset" : "UTF-8",
    "path" : [ ],
    "query" : [ ]
  },
  "headers" : [ ],
  "cookies" : [ ],
  "body" : {
    "type" : "MULTIPART_FORM",
    "charset" : "UTF-8",
    "multiPartForm" : [ {
      "key" : "myparam",
      "value" : "123",
      "selected" : true,
      "valueContentType" : "text/plain",
      "type" : "TEXT"
    }, {
      "key" : "myfile",
      "value" : "{{collectionFileDir}}/bx-folder.svg",
      "selected" : true,
      "valueContentType" : "image/svg+xml",
      "type" : "FILE"
    }, {
      "key" : "token",
      "value" : "{{token}}",
      "selected" : true,
      "valueContentType" : "text/plain",
      "type" : "TEXT"
    }, {
      "key" : "disabled1",
      "value" : "notSend!",
      "selected" : false,
      "valueContentType" : "text/plain",
      "type" : "TEXT"
    }, {
      "key" : "disabled2",
      "value" : "/Users/claudio/OneDrive/Imagens/WAF.png",
      "selected" : false,
      "valueContentType" : "image/png",
      "type" : "FILE"
    }, {
      "key" : "disabled3",
      "value" : "{{token}}",
      "selected" : false,
      "valueContentType" : "text/plain",
      "type" : "TEXT"
    } ]
  }
}