{
  "id" : "rUqpR5UJ",
  "createTime" : "2025-01-20T14:00:36",
  "updateTime" : "2025-02-06T13:39:19",
  "name" : "/cookie.php",
  "method" : "GET",
  "url" : "{{echoServer}}/cookie.php",
  "urlParam" : {
    "charset" : "UTF-8",
    "path" : [ ],
    "query" : [ ]
  },
  "headers" : [ ],
  "cookies" : [ ],
  "body" : {
    "type" : "NO_BODY",
    "charset" : "UTF-8"
  }
}