{
  "id" : "8EJRkvf4",
  "createTime" : "2025-01-31T17:15:07",
  "updateTime" : "2025-03-08T00:14:24",
  "name" : "Body XML",
  "method" : "POST",
  "url" : "{{echoServer}}/echo-iso-8859-1.php",
  "urlParam" : {
    "charset" : "UTF-8",
    "path" : [ ],
    "query" : [ ]
  },
  "headers" : [ ],
  "cookies" : [ ],
  "body" : {
    "type" : "RAW",
    "charset" : "ISO-8859-1",
    "raw" : {
      "type" : "XML",
      "raw" : "<?xml version=\"1.0\" encoding=\"ISO-8859-1\"?>\n<root>\n    <foo>Ação Açucar</foo>\n</root>"
    }
  }
}