{
  "id" : "4Ggthbte",
  "createTime" : "2024-12-18T23:20:09",
  "updateTime" : "2025-03-08T00:07:52",
  "name" : "Response PDF",
  "method" : "GET",
  "url" : "{{echoServer}}/sample.pdf",
  "urlParam" : {
    "charset" : "UTF-8",
    "path" : [ ],
    "query" : [ ]
  },
  "headers" : [ ],
  "cookies" : [ ],
  "body" : {
    "type" : "NO_BODY",
    "charset" : "UTF-8"
  }
}