{
  "id" : "sZNFfOCY",
  "createTime" : "2025-01-17T17:02:00",
  "updateTime" : "2025-03-08T00:24:06",
  "name" : "Variables Builder",
  "method" : "GET",
  "url" : "{{echoServer}}/echo.php?localtoken=:localtoken&disabled=:disabled",
  "urlParam" : {
    "charset" : "UTF-8",
    "path" : [ {
      "key" : "php",
      "value" : "echo.php",
      "selected" : true
    }, {
      "key" : "localtoken",
      "value" : "{{token}}",
      "selected" : true
    }, {
      "key" : "disabled",
      "value" : "no Inject",
      "selected" : false
    } ],
    "query" : [ ]
  },
  "headers" : [ ],
  "cookies" : [ ],
  "body" : {
    "type" : "NO_BODY",
    "charset" : "UTF-8"
  }
}