{
  "id" : "8bV40muQ",
  "createTime" : "2024-12-18T23:36:03",
  "updateTime" : "2025-03-08T00:24:47",
  "name" : "Json Body",
  "method" : "PUT",
  "url" : "{{echoServer}}/echo.php",
  "urlParam" : {
    "charset" : "UTF-8",
    "path" : [ ],
    "query" : [ ]
  },
  "headers" : [ ],
  "cookies" : [ ],
  "body" : {
    "type" : "RAW",
    "charset" : "UTF-8",
    "raw" : {
      "type" : "JSON",
      "raw" : "{\n\t\"foo\": \"bar\"\n}"
    }
  }
}