{
  "id" : "Dm078clh",
  "createTime" : "2024-12-18T23:23:55",
  "updateTime" : "2025-03-08T00:08:30",
  "name" : "Response gzip",
  "method" : "GET",
  "url" : "{{echoServer}}/echo.php",
  "urlParam" : {
    "charset" : "UTF-8",
    "path" : [ ],
    "query" : [ ]
  },
  "headers" : [ {
    "key" : "accept-encoding",
    "value" : "gzip",
    "selected" : true
  } ],
  "cookies" : [ ],
  "body" : {
    "type" : "NO_BODY",
    "charset" : "UTF-8"
  }
}