{
  "id" : "rppSDkLD",
  "createTime" : "2024-12-18T23:00:22",
  "updateTime" : "2025-03-08T00:06:26",
  "name" : "Basic POST",
  "method" : "POST",
  "url" : "{{echoServer}}/echo.php",
  "urlParam" : {
    "charset" : "UTF-8",
    "path" : [ ],
    "query" : [ ]
  },
  "headers" : [ ],
  "cookies" : [ ],
  "body" : {
    "type" : "NO_BODY",
    "charset" : "UTF-8"
  }
}