{
  "id" : "LrkL7hPM",
  "createTime" : "2024-12-18T23:37:37",
  "updateTime" : "2025-03-08T00:06:16",
  "name" : "Basic DELETE",
  "method" : "DELETE",
  "url" : "{{echoServer}}/echo.php",
  "urlParam" : {
    "charset" : "UTF-8",
    "path" : [ ],
    "query" : [ ]
  },
  "headers" : [ ],
  "cookies" : [ ],
  "body" : {
    "type" : "NO_BODY",
    "charset" : "UTF-8"
  }
}