{
  "id" : "55w7W0xw",
  "createTime" : "2024-12-18T23:06:02",
  "updateTime" : "2025-03-08T00:07:40",
  "name" : "Response Redirect",
  "method" : "GET",
  "url" : "{{echoServer}}/redirect.php",
  "urlParam" : {
    "charset" : "UTF-8",
    "path" : [ ],
    "query" : [ ]
  },
  "headers" : [ ],
  "cookies" : [ ],
  "body" : {
    "type" : "NO_BODY",
    "charset" : "UTF-8"
  }
}