{
  "id" : "0b3cAtrM",
  "createTime" : "2024-12-18T23:06:02",
  "updateTime" : "2025-02-06T13:43:45",
  "name" : "/sample-lvl2",
  "method" : "GET",
  "url" : "http://localhost:8080/sample-lvl2",
  "urlParam" : {
    "charset" : "UTF-8",
    "path" : [ ],
    "query" : [ ]
  },
  "headers" : [ ],
  "cookies" : [ ],
  "body" : {
    "type" : "NO_BODY",
    "charset" : "UTF-8"
  }
}