{
  "id" : "UsxByseb",
  "createTime" : "2024-12-18T23:02:11",
  "updateTime" : "2025-03-08T00:23:57",
  "name" : "Raw QueryParam",
  "method" : "GET",
  "url" : "http://localhost:8000/echo.php?param=value",
  "urlParam" : {
    "charset" : "UTF-8",
    "path" : [ ],
    "query" : [ ]
  },
  "headers" : [ ],
  "cookies" : [ ],
  "body" : {
    "type" : "NO_BODY",
    "charset" : "UTF-8"
  }
}