{
  "id" : "eIrkVbCc",
  "createTime" : "2025-01-17T16:59:24",
  "updateTime" : "2025-03-08T00:12:31",
  "name" : "Query Params Builder",
  "method" : "GET",
  "url" : "{{echoServer}}/echo.php",
  "urlParam" : {
    "charset" : "UTF-8",
    "path" : [ ],
    "query" : [ {
      "key" : "myparam1",
      "value" : "teste",
      "selected" : true,
      "valueContentType" : "text/plain"
    }, {
      "key" : "myparam2",
      "value" : "<code> encoded",
      "selected" : true,
      "valueContentType" : "text/plain"
    }, {
      "key" : "myparam3",
      "value" : "{{token}}",
      "selected" : true,
      "valueContentType" : "text/plain"
    }, {
      "key" : "disabled",
      "value" : "no Send!",
      "selected" : false,
      "valueContentType" : "text/plain"
    } ]
  },
  "headers" : [ ],
  "cookies" : [ ],
  "body" : {
    "type" : "NO_BODY",
    "charset" : "UTF-8"
  }
}