{
  "id" : "bcjK27md",
  "createTime" : "2024-12-18T23:40:07",
  "updateTime" : "2025-03-08T00:05:28",
  "name" : "Basic PATCH",
  "method" : "PATCH",
  "url" : "{{echoServer}}/echo.php",
  "urlParam" : {
    "charset" : "UTF-8",
    "path" : [ ],
    "query" : [ ]
  },
  "headers" : [ ],
  "cookies" : [ ],
  "body" : {
    "type" : "NO_BODY",
    "charset" : "UTF-8"
  }
}