{
  "id" : "Cio4Ribc",
  "createTime" : "2024-12-18T23:17:18",
  "updateTime" : "2025-02-06T17:24:19",
  "name" : "send-cookie",
  "method" : "GET",
  "url" : "{{echoServer}}/cookie.php",
  "urlParam" : {
    "charset" : "UTF-8",
    "path" : [ ],
    "query" : [ ]
  },
  "headers" : [ ],
  "cookies" : [ {
    "key" : "PHPSESSID",
    "value" : "87cc08dd891bde98217c632cc073c897",
    "selected" : true
  } ],
  "body" : {
    "type" : "NO_BODY",
    "charset" : "UTF-8"
  }
}