{
  "id" : "tmCsbrzA",
  "createTime" : "2024-12-18T23:26:19",
  "updateTime" : "2025-02-06T19:43:49",
  "name" : "multipart-form",
  "method" : "POST",
  "url" : "{{echoServer}}/echo.php",
  "urlParam" : {
    "charset" : "UTF-8",
    "path" : [ ],
    "query" : [ ]
  },
  "headers" : [ ],
  "cookies" : [ ],
  "body" : {
    "type" : "MULTIPART_FORM",
    "charset" : "UTF-8",
    "multiPartForm" : [ {
      "key" : "myparam",
      "value" : "123",
      "selected" : true,
      "valueContentType" : "text/plain",
      "type" : "TEXT"
    }, {
      "key" : "myfile",
      "value" : "C:\\Users\\claudio\\OneDrive\\Documentos\\BhuiyanManuscript.pdf",
      "selected" : true,
      "valueContentType" : "application/pdf",
      "type" : "FILE"
    }, {
      "key" : "token",
      "value" : "{{token}}",
      "selected" : true,
      "valueContentType" : "text/plain",
      "type" : "TEXT"
    }, {
      "key" : "disabled1",
      "value" : "notSend!",
      "selected" : false,
      "valueContentType" : "text/plain",
      "type" : "TEXT"
    }, {
      "key" : "disabled2",
      "value" : "C:\\Users\\claudio\\OneDrive\\Documentos\\aaa.csv",
      "selected" : false,
      "valueContentType" : "text/plain",
      "type" : "FILE"
    }, {
      "key" : "disabled3",
      "value" : "{{token}}",
      "selected" : false,
      "valueContentType" : "text/plain",
      "type" : "TEXT"
    } ]
  }
}