{
  "id" : "I1YypqBa",
  "createTime" : "2025-01-31T17:11:52",
  "updateTime" : "2025-02-06T13:40:27",
  "name" : "multipart-form",
  "method" : "POST",
  "url" : "{{echoServer}}/echo-iso-8859-1.php",
  "urlParam" : {
    "charset" : "UTF-8",
    "path" : [ ],
    "query" : [ ]
  },
  "headers" : [ ],
  "cookies" : [ ],
  "body" : {
    "type" : "MULTIPART_FORM",
    "charset" : "ISO-8859-1",
    "multiPartForm" : [ {
      "key" : "param1",
      "value" : "Ação Açucar",
      "selected" : true,
      "valueContentType" : "text/plain",
      "type" : "TEXT"
    } ]
  }
}