{
  "id" : "keyXRqWc",
  "createTime" : "2024-12-18T23:15:15",
  "updateTime" : "2025-03-08T00:03:41",
  "name" : "Delay 6s",
  "method" : "GET",
  "url" : "{{echoServer}}/delay.php",
  "urlParam" : {
    "charset" : "UTF-8",
    "path" : [ ],
    "query" : [ ]
  },
  "headers" : [ ],
  "cookies" : [ ],
  "body" : {
    "type" : "NO_BODY",
    "charset" : "UTF-8"
  }
}