{
  "id" : "IcWr9ZzV",
  "createTime" : "2024-12-18T23:38:23",
  "updateTime" : "2025-03-08T00:05:48",
  "name" : "Basic HEAD",
  "method" : "HEAD",
  "url" : "{{echoServer}}/echo.php",
  "urlParam" : {
    "charset" : "UTF-8",
    "path" : [ ],
    "query" : [ ]
  },
  "headers" : [ ],
  "cookies" : [ ],
  "body" : {
    "type" : "NO_BODY",
    "charset" : "UTF-8"
  }
}